{
  "data": {
    "path": "plots/nyc/experiments/../.data/lst_summer.tif",
    "format": "tiff",
    "secondary": {}
  },
  "metadata": {
    "resolution_m": 30,
    "dimensions": {
      "rows": 7781,
      "cols": 7661
    },
    "bbox": [
      527085,
      756915,
      4348785,
      4582215
    ],
    "band_count": 1,
    "nodata_percentage": 31.62,
    "value_range": {
      "min": "Inf",
      "max": "-Inf"
    },
    "dtype": "INT2U",
    "crs": "EPSG:32618",
    "nodata_percent": 31.6,
    "value_range.1": [
      39007,
      52498
    ],
    "expected_units": {},
    "passthrough": true,
    "original_path": "plots/nyc/experiments/../.data/lst_summer.tif",
    "semantic_type": "lst_checked",
    "data_category": "raster"
  },
  "provenance": [
    {
      "primitive": "validate_raster",
      "version": "1.0.0",
      "timestamp": "2026-08-09T02:05:40.435603+00:00",
      "params": {
        "max_nodata_percent": 20
      },
      "inputs": [
        {
          "name": "raster",
          "semantic_type": "land_surface_temperature",
          "path": "plots/nyc/experiments/../.data/lst_summer.tif",
          "hash": {
            "value": "f2ef1fa6a5e1759b45db6207a1300cbb",
            "method": "metadata",
            "algorithm": "md5"
          }
        }
      ],
      "duration_seconds": 6.987,
      "lineage_branch": null
    }
  ],
  "warnings": [
    {
      "level": "info",
      "primitive": "validate_raster",
      "message": "CRS: EPSG:32618 (WGS 84 / UTM zone 18N)"
    },
    {
      "level": "info",
      "primitive": "validate_raster",
      "message": "Resolution: 30.00 x 30.00 map units"
    },
    {
      "level": "critical",
      "primitive": "validate_raster",
      "message": "NoData is 31.6% (threshold: 20%). Results may be unreliable."
    }
  ]
}