{
  "data": {
    "path": "plots/nyc/experiments/../.data/parks.geojson",
    "format": "geojson",
    "secondary": {}
  },
  "metadata": {
    "feature_count": 2058,
    "geometry_type": "MULTIPOLYGON",
    "bbox": [
      -74.2561,
      40.4945,
      -73.7091,
      40.9113
    ],
    "crs": "EPSG:4326",
    "attribute_fields": [
      "jurisdiction",
      "mapped",
      "zipcode",
      "acres",
      "location",
      "nys_assembly",
      "councildistrict",
      "typecategory",
      "us_congress",
      "parentid",
      "gispropnum",
      "retired",
      "communityboard",
      "objectid",
      "globalid",
      "name311",
      "department",
      "pip_ratable",
      "subcategory",
      "precinct",
      "permit",
      "acquisitiondate",
      "omppropid",
      "gisobjid",
      "signname",
      "address",
      "permitparent",
      "class",
      "nys_senate",
      "permitdistrict",
      "borough",
      "waterfront"
    ],
    "total_area_m2": 117128680.8996,
    "validation": {
      "invalid_count": 14,
      "empty_count": 0,
      "geometry_types": "MULTIPOLYGON"
    },
    "semantic_type": "park_boundaries_checked",
    "data_category": "vector"
  },
  "provenance": [
    {
      "primitive": "validate_vector",
      "version": "1.0.0",
      "timestamp": "2026-08-09T02:06:35.751682+00:00",
      "params": {},
      "inputs": [
        {
          "name": "features",
          "semantic_type": "park_boundaries",
          "path": "plots/nyc/experiments/../.data/parks.geojson",
          "hash": {
            "value": "75e568631850cf3254098fdbc972b0b1",
            "method": "metadata",
            "algorithm": "md5"
          }
        }
      ],
      "duration_seconds": 1.804,
      "lineage_branch": null
    }
  ],
  "warnings": [
    {
      "level": "info",
      "primitive": "validate_vector",
      "message": "Feature count: 2058"
    },
    {
      "level": "info",
      "primitive": "validate_vector",
      "message": "CRS: EPSG:4326"
    },
    {
      "level": "warning",
      "primitive": "validate_vector",
      "message": "14 geometries invalid (0.7%). Consider running repair_geometry."
    },
    {
      "level": "info",
      "primitive": "validate_vector",
      "message": "Geometry type: MULTIPOLYGON"
    }
  ]
}