{
  "data": {
    "path": "plots/nyc/experiments/../.data/sample_after_filter_parks_sampled.geojson",
    "format": "geojson",
    "secondary": {}
  },
  "metadata": {
    "feature_count": 25,
    "geometry_type": "MULTIPOLYGON",
    "bbox": [
      929557.3299,
      140060.4507,
      1057522.667,
      269010.7577
    ],
    "crs": "EPSG:2263",
    "attribute_fields": [
      "borough",
      "jurisdiction",
      "mapped",
      "zipcode",
      "acres",
      "location",
      "nys_assembly",
      "councildistrict",
      "typecategory",
      "us_congress",
      "parentid",
      "gispropnum",
      "retired",
      "communityboard",
      "objectid",
      "globalid",
      "name311",
      "department",
      "pip_ratable",
      "subcategory",
      "precinct",
      "permit",
      "acquisitiondate",
      "omppropid",
      "gisobjid",
      "signname",
      "address",
      "permitparent",
      "class",
      "nys_senate",
      "permitdistrict",
      "waterfront"
    ],
    "total_area_m2": 9513156.3494,
    "features_before": 21670,
    "features_after": 25,
    "method": "stratified",
    "seed": 42,
    "stratify_by": "borough",
    "filter_expression": {},
    "n_feature_ids": {},
    "sampling_layer": "r_primitive",
    "semantic_type": "park_boundaries_filtered",
    "data_category": "vector"
  },
  "provenance": [
    {
      "primitive": "validate_vector",
      "version": "1.0.0",
      "timestamp": "2026-06-12T18:47:06.192839+00:00",
      "params": {},
      "inputs": [
        {
          "name": "features",
          "semantic_type": "park_boundaries",
          "path": "plots/nyc/experiments/../.data/parks.geojson",
          "hash": {
            "value": "75e568631850cf3254098fdbc972b0b1",
            "method": "metadata",
            "algorithm": "md5"
          }
        }
      ],
      "duration_seconds": 2.004,
      "lineage_branch": "features"
    },
    {
      "primitive": "repair_geometry",
      "version": "1.0.0",
      "timestamp": "2026-06-12T18:47:08.669911+00:00",
      "params": {},
      "inputs": [
        {
          "name": "features",
          "semantic_type": "park_boundaries_checked",
          "path": "plots/nyc/experiments/../.data/parks.geojson",
          "hash": {
            "value": "75e568631850cf3254098fdbc972b0b1",
            "method": "metadata",
            "algorithm": "md5"
          }
        }
      ],
      "duration_seconds": 2.475,
      "lineage_branch": "features"
    },
    {
      "primitive": "reproject_vector",
      "version": "1.0.0",
      "timestamp": "2026-06-12T18:47:10.807251+00:00",
      "params": {
        "target_crs": "EPSG:2263"
      },
      "inputs": [
        {
          "name": "features",
          "semantic_type": "park_boundaries_repaired",
          "path": "plots/nyc/experiments/../.data/repair_parks_repaired.geojson",
          "hash": {
            "value": "5121c9a6ec670a4198a159397843d1a8",
            "method": "metadata",
            "algorithm": "md5"
          }
        }
      ],
      "duration_seconds": 2.135,
      "lineage_branch": "features"
    },
    {
      "primitive": "filter_by_area",
      "version": "1.0.0",
      "timestamp": "2026-06-12T18:47:17.446447+00:00",
      "params": {
        "min_area_ha": 0.09
      },
      "inputs": [
        {
          "name": "features",
          "semantic_type": "park_boundaries_reprojected",
          "path": "plots/nyc/experiments/../.data/reproject_parks_reprojected.geojson",
          "hash": {
            "value": "c0bcf3ca18d016e011c75520cecf9e93",
            "method": "metadata",
            "algorithm": "md5"
          }
        }
      ],
      "duration_seconds": 6.636,
      "lineage_branch": "features"
    },
    {
      "primitive": "sample_features",
      "version": "1.0.0",
      "timestamp": "2026-06-12T18:47:23.899881+00:00",
      "params": {
        "method": "stratified",
        "n": 50,
        "n_per_stratum": 5,
        "stratify_by": "auto",
        "seed": 42,
        "filter": null,
        "feature_ids": null
      },
      "inputs": [
        {
          "name": "features",
          "semantic_type": "park_boundaries_filtered",
          "path": "plots/nyc/experiments/../.data/filter_parks_filtered.geojson",
          "hash": {
            "value": "dce3afb740548f25b339ec8ad7c3e8df",
            "method": "metadata",
            "algorithm": "md5"
          }
        }
      ],
      "duration_seconds": 6.451,
      "lineage_branch": null
    }
  ],
  "warnings": [
    {
      "level": "info",
      "primitive": "validate_vector",
      "message": "Feature count: 2058"
    },
    {
      "level": "info",
      "primitive": "validate_vector",
      "message": "CRS: EPSG:4326"
    },
    {
      "level": "warning",
      "primitive": "validate_vector",
      "message": "14 geometries invalid (0.7%). Consider running repair_geometry."
    },
    {
      "level": "info",
      "primitive": "validate_vector",
      "message": "Geometry type: MULTIPOLYGON"
    },
    {
      "level": "info",
      "primitive": "repair_geometry",
      "message": "Loaded 2058 features"
    },
    {
      "level": "info",
      "primitive": "repair_geometry",
      "message": "Found 14 invalid geometries (0.7%)"
    },
    {
      "level": "info",
      "primitive": "repair_geometry",
      "message": "Repaired 14 geometries"
    },
    {
      "level": "info",
      "primitive": "repair_geometry",
      "message": "Wrote repaired features to repair_parks_repaired.geojson"
    },
    {
      "level": "info",
      "primitive": "reproject_vector",
      "message": "Loaded 2058 features"
    },
    {
      "level": "info",
      "primitive": "reproject_vector",
      "message": "Transforming from EPSG:4326 to EPSG:2263"
    },
    {
      "level": "info",
      "primitive": "reproject_vector",
      "message": "Transformation complete"
    },
    {
      "level": "info",
      "primitive": "reproject_vector",
      "message": "Wrote transformed features to reproject_parks_reprojected.geojson"
    },
    {
      "level": "warning",
      "primitive": "filter_by_area",
      "message": "Excluded 88 of 2058 features outside [0.09, Inf] ha range."
    },
    {
      "level": "info",
      "primitive": "filter_by_area",
      "message": "Excluded feature areas: min=0.0026 ha, max=0.09 ha, median=0.0364 ha."
    },
    {
      "level": "info",
      "primitive": "sample_features",
      "message": "Sampled 25 of 21670 features using method='stratified'."
    }
  ]
}