{
  "data": {
    "path": "plots/nyc/experiments/../.data/scale_lst_scaled.tiff",
    "format": "tiff",
    "secondary": {}
  },
  "metadata": {
    "resolution_m": 30,
    "dimensions": {
      "rows": 7781,
      "cols": 7661
    },
    "bbox": [
      527085,
      756915,
      4348785,
      4582215
    ],
    "band_count": 1,
    "nodata_percentage": 31.62,
    "value_range": {
      "min": 9.1767,
      "max": 55.2892
    },
    "dtype": "",
    "crs": "EPSG:32618",
    "scale_factor": 0.0034,
    "offset": -124.15,
    "from_unit": "landsat_dn",
    "to_unit": "celsius",
    "value_range_before": [
      39007,
      52498
    ],
    "value_range_after": [
      9.1767,
      55.2892
    ],
    "semantic_type": "lst_scaled",
    "data_category": "raster"
  },
  "provenance": [
    {
      "primitive": "validate_raster",
      "version": "1.0.0",
      "timestamp": "2026-08-09T02:05:40.435603+00:00",
      "params": {
        "max_nodata_percent": 20
      },
      "inputs": [
        {
          "name": "raster",
          "semantic_type": "land_surface_temperature",
          "path": "plots/nyc/experiments/../.data/lst_summer.tif",
          "hash": {
            "value": "f2ef1fa6a5e1759b45db6207a1300cbb",
            "method": "metadata",
            "algorithm": "md5"
          }
        }
      ],
      "duration_seconds": 6.987,
      "lineage_branch": "raster"
    },
    {
      "primitive": "scale_raster",
      "version": "1.0.0",
      "timestamp": "2026-08-09T02:05:50.963954+00:00",
      "params": {
        "scale": 0.00341802,
        "offset": -124.15,
        "from_unit": "landsat_dn",
        "to_unit": "celsius"
      },
      "inputs": [
        {
          "name": "raster",
          "semantic_type": "lst_checked",
          "path": "plots/nyc/experiments/../.data/lst_summer.tif",
          "hash": {
            "value": "f2ef1fa6a5e1759b45db6207a1300cbb",
            "method": "metadata",
            "algorithm": "md5"
          }
        }
      ],
      "duration_seconds": 10.525,
      "lineage_branch": null
    }
  ],
  "warnings": [
    {
      "level": "info",
      "primitive": "validate_raster",
      "message": "CRS: EPSG:32618 (WGS 84 / UTM zone 18N)"
    },
    {
      "level": "info",
      "primitive": "validate_raster",
      "message": "Resolution: 30.00 x 30.00 map units"
    },
    {
      "level": "critical",
      "primitive": "validate_raster",
      "message": "NoData is 31.6% (threshold: 20%). Results may be unreliable."
    },
    {
      "level": "info",
      "primitive": "scale_raster",
      "message": "Converted from landsat_dn to celsius: values [39007.00, 52498.00] -> [9.18, 55.29]"
    }
  ]
}