{
  "data": {
    "path": "plots/nyc/experiments/../.data/reproject_parks_reprojected.geojson",
    "format": "geojson",
    "secondary": {}
  },
  "metadata": {
    "feature_count": 2058,
    "geometry_type": "MULTIPOLYGON",
    "bbox": [
      913033.1985,
      119521.6429,
      1064870.6384,
      271316.9822
    ],
    "crs": "EPSG:2263",
    "attribute_fields": [
      "jurisdiction",
      "mapped",
      "zipcode",
      "acres",
      "location",
      "nys_assembly",
      "councildistrict",
      "typecategory",
      "us_congress",
      "parentid",
      "gispropnum",
      "retired",
      "communityboard",
      "objectid",
      "globalid",
      "name311",
      "department",
      "pip_ratable",
      "subcategory",
      "precinct",
      "permit",
      "acquisitiondate",
      "omppropid",
      "gisobjid",
      "signname",
      "address",
      "permitparent",
      "class",
      "nys_senate",
      "permitdistrict",
      "borough",
      "waterfront"
    ],
    "total_area_m2": 1260759102.7523,
    "transform": {
      "source_crs": "EPSG:4326",
      "target_crs": "EPSG:2263",
      "transformed": true
    },
    "semantic_type": "park_boundaries_reprojected",
    "data_category": "vector"
  },
  "provenance": [
    {
      "primitive": "validate_vector",
      "version": "1.0.0",
      "timestamp": "2026-08-09T02:06:35.751682+00:00",
      "params": {},
      "inputs": [
        {
          "name": "features",
          "semantic_type": "park_boundaries",
          "path": "plots/nyc/experiments/../.data/parks.geojson",
          "hash": {
            "value": "75e568631850cf3254098fdbc972b0b1",
            "method": "metadata",
            "algorithm": "md5"
          }
        }
      ],
      "duration_seconds": 1.804,
      "lineage_branch": "features"
    },
    {
      "primitive": "repair_geometry",
      "version": "1.0.0",
      "timestamp": "2026-08-09T02:06:38.270803+00:00",
      "params": {},
      "inputs": [
        {
          "name": "features",
          "semantic_type": "park_boundaries_checked",
          "path": "plots/nyc/experiments/../.data/parks.geojson",
          "hash": {
            "value": "75e568631850cf3254098fdbc972b0b1",
            "method": "metadata",
            "algorithm": "md5"
          }
        }
      ],
      "duration_seconds": 2.516,
      "lineage_branch": "features"
    },
    {
      "primitive": "reproject_vector",
      "version": "1.0.0",
      "timestamp": "2026-08-09T02:06:40.429930+00:00",
      "params": {
        "target_crs": "EPSG:2263"
      },
      "inputs": [
        {
          "name": "features",
          "semantic_type": "park_boundaries_repaired",
          "path": "plots/nyc/experiments/../.data/repair_parks_repaired.geojson",
          "hash": {
            "value": "3a6c7f9638900ac205793a5f6b08ecef",
            "method": "metadata",
            "algorithm": "md5"
          }
        }
      ],
      "duration_seconds": 2.157,
      "lineage_branch": null
    }
  ],
  "warnings": [
    {
      "level": "info",
      "primitive": "validate_vector",
      "message": "Feature count: 2058"
    },
    {
      "level": "info",
      "primitive": "validate_vector",
      "message": "CRS: EPSG:4326"
    },
    {
      "level": "warning",
      "primitive": "validate_vector",
      "message": "14 geometries invalid (0.7%). Consider running repair_geometry."
    },
    {
      "level": "info",
      "primitive": "validate_vector",
      "message": "Geometry type: MULTIPOLYGON"
    },
    {
      "level": "info",
      "primitive": "repair_geometry",
      "message": "Loaded 2058 features"
    },
    {
      "level": "info",
      "primitive": "repair_geometry",
      "message": "Found 14 invalid geometries (0.7%)"
    },
    {
      "level": "info",
      "primitive": "repair_geometry",
      "message": "Repaired 14 geometries"
    },
    {
      "level": "info",
      "primitive": "repair_geometry",
      "message": "Wrote repaired features to repair_parks_repaired.geojson"
    },
    {
      "level": "info",
      "primitive": "reproject_vector",
      "message": "Loaded 2058 features"
    },
    {
      "level": "info",
      "primitive": "reproject_vector",
      "message": "Transforming from EPSG:4326 to EPSG:2263"
    },
    {
      "level": "info",
      "primitive": "reproject_vector",
      "message": "Transformation complete"
    },
    {
      "level": "info",
      "primitive": "reproject_vector",
      "message": "Wrote transformed features to reproject_parks_reprojected.geojson"
    }
  ]
}