{
  "data": {
    "path": "plots/nyc/experiments/../.data/filter_parks_filtered.geojson",
    "format": "geojson",
    "secondary": {}
  },
  "metadata": {
    "feature_count": 1970,
    "geometry_type": "MULTIPOLYGON",
    "bbox": [
      913033.1985,
      119521.6429,
      1064870.6384,
      271316.9822
    ],
    "crs": "EPSG:2263",
    "attribute_fields": [
      "jurisdiction",
      "mapped",
      "zipcode",
      "acres",
      "location",
      "nys_assembly",
      "councildistrict",
      "typecategory",
      "us_congress",
      "parentid",
      "gispropnum",
      "retired",
      "communityboard",
      "objectid",
      "globalid",
      "name311",
      "department",
      "pip_ratable",
      "subcategory",
      "precinct",
      "permit",
      "acquisitiondate",
      "omppropid",
      "gisobjid",
      "signname",
      "address",
      "permitparent",
      "class",
      "nys_senate",
      "permitdistrict",
      "borough",
      "waterfront"
    ],
    "total_area_m2": 1260721667.797,
    "n_before": 2058,
    "n_after": 1970,
    "n_excluded": 88,
    "min_area_ha": 0.09,
    "max_area_ha": {},
    "semantic_type": "park_boundaries_filtered",
    "data_category": "vector"
  },
  "provenance": [
    {
      "primitive": "validate_vector",
      "version": "1.0.0",
      "timestamp": "2026-05-04T02:42:55.898628+00:00",
      "params": {},
      "inputs": [
        {
          "name": "features",
          "semantic_type": "park_boundaries",
          "path": "plots/nyc/experiments/../.data/parks.geojson",
          "hash": {
            "value": "75e568631850cf3254098fdbc972b0b1",
            "method": "metadata",
            "algorithm": "md5"
          }
        }
      ],
      "duration_seconds": 0.607,
      "lineage_branch": "features"
    },
    {
      "primitive": "repair_geometry",
      "version": "1.0.0",
      "timestamp": "2026-05-04T02:42:56.756693+00:00",
      "params": {},
      "inputs": [
        {
          "name": "features",
          "semantic_type": "park_boundaries_checked",
          "path": "plots/nyc/experiments/../.data/parks.geojson",
          "hash": {
            "value": "75e568631850cf3254098fdbc972b0b1",
            "method": "metadata",
            "algorithm": "md5"
          }
        }
      ],
      "duration_seconds": 0.857,
      "lineage_branch": "features"
    },
    {
      "primitive": "reproject_vector",
      "version": "1.0.0",
      "timestamp": "2026-05-04T02:42:57.398511+00:00",
      "params": {
        "target_crs": "EPSG:2263"
      },
      "inputs": [
        {
          "name": "features",
          "semantic_type": "park_boundaries_repaired",
          "path": "plots/nyc/experiments/../.data/repair_parks_repaired.geojson",
          "hash": {
            "value": "3a641869f060363c010b1f02bfbc7c9b",
            "method": "metadata",
            "algorithm": "md5"
          }
        }
      ],
      "duration_seconds": 0.641,
      "lineage_branch": "features"
    },
    {
      "primitive": "filter_by_area",
      "version": "1.0.0",
      "timestamp": "2026-05-04T02:42:58.283356+00:00",
      "params": {
        "min_area_ha": 0.09
      },
      "inputs": [
        {
          "name": "features",
          "semantic_type": "park_boundaries_reprojected",
          "path": "plots/nyc/experiments/../.data/reproject_parks_reprojected.geojson",
          "hash": {
            "value": "8b01e8962d7aff2e74afaac83a56cd3f",
            "method": "metadata",
            "algorithm": "md5"
          }
        }
      ],
      "duration_seconds": 0.884,
      "lineage_branch": null
    }
  ],
  "warnings": [
    {
      "level": "info",
      "primitive": "validate_vector",
      "message": "Feature count: 2058"
    },
    {
      "level": "info",
      "primitive": "validate_vector",
      "message": "CRS: EPSG:4326"
    },
    {
      "level": "warning",
      "primitive": "validate_vector",
      "message": "14 geometries invalid (0.7%). Consider running repair_geometry."
    },
    {
      "level": "info",
      "primitive": "validate_vector",
      "message": "Geometry type: MULTIPOLYGON"
    },
    {
      "level": "info",
      "primitive": "repair_geometry",
      "message": "Loaded 2058 features"
    },
    {
      "level": "info",
      "primitive": "repair_geometry",
      "message": "Found 14 invalid geometries (0.7%)"
    },
    {
      "level": "info",
      "primitive": "repair_geometry",
      "message": "Repaired 14 geometries"
    },
    {
      "level": "info",
      "primitive": "repair_geometry",
      "message": "Wrote repaired features to repair_parks_repaired.geojson"
    },
    {
      "level": "info",
      "primitive": "reproject_vector",
      "message": "Loaded 2058 features"
    },
    {
      "level": "info",
      "primitive": "reproject_vector",
      "message": "Transforming from EPSG:4326 to EPSG:2263"
    },
    {
      "level": "info",
      "primitive": "reproject_vector",
      "message": "Transformation complete"
    },
    {
      "level": "info",
      "primitive": "reproject_vector",
      "message": "Wrote transformed features to reproject_parks_reprojected.geojson"
    },
    {
      "level": "warning",
      "primitive": "filter_by_area",
      "message": "Excluded 88 of 2058 features outside [0.09, Inf] ha range."
    },
    {
      "level": "info",
      "primitive": "filter_by_area",
      "message": "Excluded feature areas: min=0.0026 ha, max=0.09 ha, median=0.0364 ha."
    }
  ]
}