{
  "data": {
    "path": "plots/nyc/experiments/../.data/reproject_lst_reprojected.tiff",
    "format": "tiff",
    "secondary": {}
  },
  "metadata": {
    "resolution_m": 98.4439,
    "dimensions": {
      "rows": 7866,
      "cols": 7749
    },
    "bbox": [
      790027.4072,
      1552868.9614,
      -327565.3568,
      446794.1302
    ],
    "band_count": 1,
    "nodata_percentage": 33.13,
    "value_range": {
      "min": 9.1869,
      "max": 55.0508
    },
    "dtype": "",
    "crs": "EPSG:2263",
    "source_crs": "EPSG:32618",
    "target_crs": "EPSG:2263",
    "resampling_method": "bilinear",
    "semantic_type": "lst_reprojected",
    "data_category": "raster"
  },
  "provenance": [
    {
      "primitive": "validate_raster",
      "version": "1.0.0",
      "timestamp": "2026-08-09T02:05:40.435603+00:00",
      "params": {
        "max_nodata_percent": 20
      },
      "inputs": [
        {
          "name": "raster",
          "semantic_type": "land_surface_temperature",
          "path": "plots/nyc/experiments/../.data/lst_summer.tif",
          "hash": {
            "value": "f2ef1fa6a5e1759b45db6207a1300cbb",
            "method": "metadata",
            "algorithm": "md5"
          }
        }
      ],
      "duration_seconds": 6.987,
      "lineage_branch": "raster"
    },
    {
      "primitive": "scale_raster",
      "version": "1.0.0",
      "timestamp": "2026-08-09T02:05:50.963954+00:00",
      "params": {
        "scale": 0.00341802,
        "offset": -124.15,
        "from_unit": "landsat_dn",
        "to_unit": "celsius"
      },
      "inputs": [
        {
          "name": "raster",
          "semantic_type": "lst_checked",
          "path": "plots/nyc/experiments/../.data/lst_summer.tif",
          "hash": {
            "value": "f2ef1fa6a5e1759b45db6207a1300cbb",
            "method": "metadata",
            "algorithm": "md5"
          }
        }
      ],
      "duration_seconds": 10.525,
      "lineage_branch": "raster"
    },
    {
      "primitive": "reproject_raster",
      "version": "1.0.0",
      "timestamp": "2026-08-09T02:06:33.945070+00:00",
      "params": {
        "target_crs": "EPSG:2263",
        "method": "bilinear"
      },
      "inputs": [
        {
          "name": "raster",
          "semantic_type": "lst_scaled",
          "path": "plots/nyc/experiments/../.data/scale_lst_scaled.tiff",
          "hash": {
            "value": "5df409c34cf87e9a0201bb2e2e44f4d8",
            "method": "metadata",
            "algorithm": "md5"
          }
        }
      ],
      "duration_seconds": 42.977,
      "lineage_branch": null
    }
  ],
  "warnings": [
    {
      "level": "info",
      "primitive": "validate_raster",
      "message": "CRS: EPSG:32618 (WGS 84 / UTM zone 18N)"
    },
    {
      "level": "info",
      "primitive": "validate_raster",
      "message": "Resolution: 30.00 x 30.00 map units"
    },
    {
      "level": "critical",
      "primitive": "validate_raster",
      "message": "NoData is 31.6% (threshold: 20%). Results may be unreliable."
    },
    {
      "level": "info",
      "primitive": "scale_raster",
      "message": "Converted from landsat_dn to celsius: values [39007.00, 52498.00] -> [9.18, 55.29]"
    },
    {
      "level": "info",
      "primitive": "reproject_raster",
      "message": "Reprojecting from EPSG:32618 to EPSG:2263 using bilinear resampling."
    }
  ]
}